{
 "arm_differentiating_field": "envelope",
 "authority": "studies/study3r/prompts/study3r_protocol_v1_authoring_authority.md",
 "deterministic_placeholder_fixture": {
  "correct_index": 0,
  "correct_label": "A",
  "depth": 2,
  "family": "D2",
  "is_scientific_item": false,
  "item_body": "You are answering a multiple-choice item.\nReply with exactly one option label and nothing else.\n\nItem: Compute (8 + 3) * 4.\nA) 44\nB) 33\nC) 51\nD) 38",
  "item_key": "31a6f3b20a03462deeb3050570e699134b9d61abcd3cfcee218b5b027e1a53c2",
  "operands": [
   8,
   3,
   4
  ],
  "operations": [
   "ADD",
   "MUL"
  ],
  "options": [
   44,
   33,
   51,
   38
  ],
  "stem": "Compute (8 + 3) * 4.",
  "value": 44
 },
 "entries": [
  {
   "answer_cue": "Answer:\n",
   "arm_id": "W1_RAW_DIRECT",
   "assistant_content": null,
   "bos_insertion": "none",
   "chat_template_sha256": null,
   "checkpoint_role": "RT",
   "d0_common_prefix_token_length": 57,
   "d0_discriminant_position": 57,
   "eos_insertion": "none in the prompt; stopping is EOS driven",
   "few_shot_examples": [],
   "frozen_reasoning_closure": "",
   "immutable_revision": "ad9f0ae0864d7fbcd1cd905e3c6c5b069cc8b562",
   "message_roles": [],
   "reasoning_span_opened_by_template": false,
   "registry_key": "RT|W1_RAW_DIRECT",
   "rendered_token_count": 57,
   "rendered_token_ids": [
    2610,
    525,
    35764,
    264,
    5248,
    62626,
    1509,
    624,
    20841,
    448,
    6896,
    825,
    2999,
    2383,
    323,
    4302,
    770,
    382,
    1234,
    25,
    22603,
    320,
    23,
    488,
    220,
    18,
    8,
    353,
    220,
    19,
    624,
    32,
    8,
    220,
    19,
    19,
    198,
    33,
    8,
    220,
    18,
    18,
    198,
    34,
    8,
    220,
    20,
    16,
    198,
    35,
    8,
    220,
    18,
    23,
    271,
    16141,
    510
   ],
   "rendered_utf8_bytes": 157,
   "rendered_utf8_sha256": "9dab5a865967308bc43b219f5b44476cc610fb0b310dd6f528dd3fd0934a4c95",
   "rendered_with_deterministic_placeholders": "You are answering a multiple-choice item.\nReply with exactly one option label and nothing else.\n\nItem: Compute (8 + 3) * 4.\nA) 44\nB) 33\nC) 51\nD) 38\n\nAnswer:\n",
   "separators": {
    "newline_bytes": "\n",
    "option_line_separator": "\n",
    "raw_envelope_separator": "\n\n"
   },
   "system_content": null,
   "tokenizer_class": "Qwen2Tokenizer",
   "user_content_source": "item_body_template"
  },
  {
   "answer_cue": "Answer:\n",
   "arm_id": "W2_ROLE_CANONICAL",
   "assistant_content": null,
   "bos_insertion": "as embedded by the frozen chat template",
   "chat_template_sha256": "56a1447ad31926fdc21fb07e56e5642bd9c850c4f52d8c8af7bbe5f079a84f5f",
   "checkpoint_role": "RT",
   "d0_common_prefix_token_length": 63,
   "d0_discriminant_position": 63,
   "eos_insertion": "none in the prompt; stopping is EOS driven",
   "few_shot_examples": [],
   "frozen_reasoning_closure": "</think>\n\n",
   "immutable_revision": "ad9f0ae0864d7fbcd1cd905e3c6c5b069cc8b562",
   "message_roles": [
    "user"
   ],
   "reasoning_span_opened_by_template": true,
   "registry_key": "RT|W2_ROLE_CANONICAL",
   "rendered_token_count": 63,
   "rendered_token_ids": [
    151646,
    151644,
    2610,
    525,
    35764,
    264,
    5248,
    62626,
    1509,
    624,
    20841,
    448,
    6896,
    825,
    2999,
    2383,
    323,
    4302,
    770,
    382,
    1234,
    25,
    22603,
    320,
    23,
    488,
    220,
    18,
    8,
    353,
    220,
    19,
    624,
    32,
    8,
    220,
    19,
    19,
    198,
    33,
    8,
    220,
    18,
    18,
    198,
    34,
    8,
    220,
    20,
    16,
    198,
    35,
    8,
    220,
    18,
    23,
    151645,
    151648,
    198,
    151649,
    271,
    16141,
    510
   ],
   "rendered_utf8_bytes": 231,
   "rendered_utf8_sha256": "3d8c066ae7729c1bda23033c24a3e397c9b1fe520e5004dcc18631368e97f052",
   "rendered_with_deterministic_placeholders": "<\uff5cbegin\u2581of\u2581sentence\uff5c><\uff5cUser\uff5c>You are answering a multiple-choice item.\nReply with exactly one option label and nothing else.\n\nItem: Compute (8 + 3) * 4.\nA) 44\nB) 33\nC) 51\nD) 38<\uff5cAssistant\uff5c><think>\n</think>\n\nAnswer:\n",
   "separators": {
    "newline_bytes": "\n",
    "option_line_separator": "\n",
    "raw_envelope_separator": "\n\n"
   },
   "system_content": null,
   "tokenizer_class": "Qwen2Tokenizer",
   "user_content_source": "item_body_template"
  },
  {
   "answer_cue": "Answer:\n",
   "arm_id": "W1_RAW_DIRECT",
   "assistant_content": null,
   "bos_insertion": "none",
   "chat_template_sha256": null,
   "checkpoint_role": "RP_B1",
   "d0_common_prefix_token_length": 57,
   "d0_discriminant_position": 57,
   "eos_insertion": "none in the prompt; stopping is EOS driven",
   "few_shot_examples": [],
   "frozen_reasoning_closure": "",
   "immutable_revision": "916b56a44061fd5cd7d6a8fb632557ed4f724f60",
   "message_roles": [],
   "reasoning_span_opened_by_template": false,
   "registry_key": "RP_B1|W1_RAW_DIRECT",
   "rendered_token_count": 57,
   "rendered_token_ids": [
    2610,
    525,
    35764,
    264,
    5248,
    62626,
    1509,
    624,
    20841,
    448,
    6896,
    825,
    2999,
    2383,
    323,
    4302,
    770,
    382,
    1234,
    25,
    22603,
    320,
    23,
    488,
    220,
    18,
    8,
    353,
    220,
    19,
    624,
    32,
    8,
    220,
    19,
    19,
    198,
    33,
    8,
    220,
    18,
    18,
    198,
    34,
    8,
    220,
    20,
    16,
    198,
    35,
    8,
    220,
    18,
    23,
    271,
    16141,
    510
   ],
   "rendered_utf8_bytes": 157,
   "rendered_utf8_sha256": "9dab5a865967308bc43b219f5b44476cc610fb0b310dd6f528dd3fd0934a4c95",
   "rendered_with_deterministic_placeholders": "You are answering a multiple-choice item.\nReply with exactly one option label and nothing else.\n\nItem: Compute (8 + 3) * 4.\nA) 44\nB) 33\nC) 51\nD) 38\n\nAnswer:\n",
   "separators": {
    "newline_bytes": "\n",
    "option_line_separator": "\n",
    "raw_envelope_separator": "\n\n"
   },
   "system_content": null,
   "tokenizer_class": "Qwen2Tokenizer",
   "user_content_source": "item_body_template"
  },
  {
   "answer_cue": "Answer:\n",
   "arm_id": "W2_ROLE_CANONICAL",
   "assistant_content": null,
   "bos_insertion": "as embedded by the frozen chat template",
   "chat_template_sha256": "56a1447ad31926fdc21fb07e56e5642bd9c850c4f52d8c8af7bbe5f079a84f5f",
   "checkpoint_role": "RP_B1",
   "d0_common_prefix_token_length": 63,
   "d0_discriminant_position": 63,
   "eos_insertion": "none in the prompt; stopping is EOS driven",
   "few_shot_examples": [],
   "frozen_reasoning_closure": "</think>\n\n",
   "immutable_revision": "916b56a44061fd5cd7d6a8fb632557ed4f724f60",
   "message_roles": [
    "user"
   ],
   "reasoning_span_opened_by_template": true,
   "registry_key": "RP_B1|W2_ROLE_CANONICAL",
   "rendered_token_count": 63,
   "rendered_token_ids": [
    151646,
    151644,
    2610,
    525,
    35764,
    264,
    5248,
    62626,
    1509,
    624,
    20841,
    448,
    6896,
    825,
    2999,
    2383,
    323,
    4302,
    770,
    382,
    1234,
    25,
    22603,
    320,
    23,
    488,
    220,
    18,
    8,
    353,
    220,
    19,
    624,
    32,
    8,
    220,
    19,
    19,
    198,
    33,
    8,
    220,
    18,
    18,
    198,
    34,
    8,
    220,
    20,
    16,
    198,
    35,
    8,
    220,
    18,
    23,
    151645,
    151648,
    198,
    151649,
    271,
    16141,
    510
   ],
   "rendered_utf8_bytes": 231,
   "rendered_utf8_sha256": "3d8c066ae7729c1bda23033c24a3e397c9b1fe520e5004dcc18631368e97f052",
   "rendered_with_deterministic_placeholders": "<\uff5cbegin\u2581of\u2581sentence\uff5c><\uff5cUser\uff5c>You are answering a multiple-choice item.\nReply with exactly one option label and nothing else.\n\nItem: Compute (8 + 3) * 4.\nA) 44\nB) 33\nC) 51\nD) 38<\uff5cAssistant\uff5c><think>\n</think>\n\nAnswer:\n",
   "separators": {
    "newline_bytes": "\n",
    "option_line_separator": "\n",
    "raw_envelope_separator": "\n\n"
   },
   "system_content": null,
   "tokenizer_class": "Qwen2Tokenizer",
   "user_content_source": "item_body_template"
  },
  {
   "answer_cue": "Answer:\n",
   "arm_id": "W1_RAW_DIRECT",
   "assistant_content": null,
   "bos_insertion": "none",
   "chat_template_sha256": null,
   "checkpoint_role": "RP_B2",
   "d0_common_prefix_token_length": 57,
   "d0_discriminant_position": 57,
   "eos_insertion": "none in the prompt; stopping is EOS driven",
   "few_shot_examples": [],
   "frozen_reasoning_closure": "",
   "immutable_revision": "1df8507178afcc1bef68cd8c393f61a886323761",
   "message_roles": [],
   "reasoning_span_opened_by_template": false,
   "registry_key": "RP_B2|W1_RAW_DIRECT",
   "rendered_token_count": 57,
   "rendered_token_ids": [
    2610,
    525,
    35764,
    264,
    5248,
    62626,
    1509,
    624,
    20841,
    448,
    6896,
    825,
    2999,
    2383,
    323,
    4302,
    770,
    382,
    1234,
    25,
    22603,
    320,
    23,
    488,
    220,
    18,
    8,
    353,
    220,
    19,
    624,
    32,
    8,
    220,
    19,
    19,
    198,
    33,
    8,
    220,
    18,
    18,
    198,
    34,
    8,
    220,
    20,
    16,
    198,
    35,
    8,
    220,
    18,
    23,
    271,
    16141,
    510
   ],
   "rendered_utf8_bytes": 157,
   "rendered_utf8_sha256": "9dab5a865967308bc43b219f5b44476cc610fb0b310dd6f528dd3fd0934a4c95",
   "rendered_with_deterministic_placeholders": "You are answering a multiple-choice item.\nReply with exactly one option label and nothing else.\n\nItem: Compute (8 + 3) * 4.\nA) 44\nB) 33\nC) 51\nD) 38\n\nAnswer:\n",
   "separators": {
    "newline_bytes": "\n",
    "option_line_separator": "\n",
    "raw_envelope_separator": "\n\n"
   },
   "system_content": null,
   "tokenizer_class": "Qwen2Tokenizer",
   "user_content_source": "item_body_template"
  },
  {
   "answer_cue": "Answer:\n",